{
  "schema_version": "0.2-draft",
  "record_status": "draft_requires_human_review",
  "collected_at": "2026-10-10",
  "document": {
    "document_key": "comparison-van-gogh-and-gauguin-arles",
    "doc_type": "artist_comparison",
    "title": "빈센트 반 고흐와 폴 고갱: 아를 공동생활과 표현 방식의 차이",
    "year": "1888",
    "artist_slugs": [
      "vincent-van-gogh",
      "paul-gauguin"
    ],
    "artwork_slug": null,
    "content": "빈센트 반 고흐와 폴 고갱은 1880년대 후반 파리의 전위 미술계에서 교류했고 작품도 주고받았다. 고갱이 소장했던 고흐의 1887년 해바라기 그림은 두 사람이 아를에서 함께 지내기 전부터 서로의 작업에 관심을 두었음을 보여 준다. 1888년 고흐는 남프랑스 아를의 노란 집을 예술가 공동체의 거점으로 만들고 싶어 고갱을 초대했다. 고갱은 그해 가을 아를에 도착해 약 두 달 동안 고흐와 함께 생활하고 작업했다. 두 사람은 강한 색과 단순화된 형태를 사용한다는 공통점이 있었지만 자연을 대하는 태도에는 차이가 있었다. 고흐는 풍경과 인물을 눈앞에서 관찰한 뒤 붓질과 색채를 통해 자신의 정서적 반응을 강화하는 경우가 많았다. 반면 고갱은 기억과 상상, 상징을 결합해 실제 장면을 재구성하는 방식을 중시했다. 이 차이는 서로에게 자극이 되었지만 생활 방식과 예술관의 갈등도 키웠다. 공동생활은 1888년 12월 고흐의 정신적 위기 전후로 끝났고 고갱은 아를을 떠났다. 이 사건을 단순히 ‘귀를 자른 화가와 친구의 다툼’으로 축소하면 두 사람의 교류가 남긴 미술사적 의미를 놓치기 쉽다. 고흐는 고갱과의 토론을 통해 색을 상징적으로 사용하는 문제를 더 깊이 고민했고, 고갱도 이후 작품에서 고흐의 해바라기를 우정과 기억의 모티프로 다시 사용했다. 두 작가의 관계는 협력, 경쟁, 상호 영향, 갈등이 동시에 존재한 짧고 복잡한 예술적 동료 관계로 이해하는 것이 적절하다.",
    "source_url": "https://www.nga.gov/artists/1349-vincent-van-gogh",
    "source_name": "National Gallery of Art; The Metropolitan Museum of Art",
    "sources": [
      {
        "source_url": "https://www.nga.gov/artists/1349-vincent-van-gogh",
        "source_name": "National Gallery of Art",
        "used_for": "고흐의 생애, 아를 시기, 고갱과의 공동생활"
      },
      {
        "source_url": "https://www.metmuseum.org/art/collection/search/436524",
        "source_name": "The Metropolitan Museum of Art",
        "used_for": "고갱이 소장한 고흐의 해바라기 작품과 두 작가의 교류"
      },
      {
        "source_url": "https://www.metmuseum.org/exhibitions/listings/2002/gauguin",
        "source_name": "The Metropolitan Museum of Art",
        "used_for": "고갱의 경력과 남태평양 시기 개요"
      }
    ],
    "license": "CC BY 4.0 (이 데이터셋의 새 한국어 해설문)",
    "content_author": "SKN35-3rd-1Team 데이터팀",
    "copyright_notice": "© 2026 SKN35-3rd-1Team 데이터팀. 공식 기관의 사실 정보에 근거해 새로 작성한 비교 해설이며 원문 해설을 번역·복제하지 않았다. CC BY 4.0에 따라 출처와 작성자를 표시하면 재사용할 수 있다.",
    "source_rights_note": "연결된 기관 페이지는 사실 확인용 참고자료다. 페이지 원문은 복제하지 않았으며 이미지 사용 시 각 소장품의 Open Access 표시를 별도로 확인해야 한다.",
    "review_status": "팀 검수 필요"
  }
}
